experiment,percentDEInCat,term,genes
enriched_vs_control,3.260869565,regulation of protein metabolic process,gene767; gene872; gene1503; gene1632; gene1633; gene2322; gene2656; gene2666; gene2959; gene4472; gene5098; gene5413; gene5540; gene5639; gene5724; gene5768; gene6416; gene7542; gene7589; gene7590; gene7780; gene7880; gene8059; gene8599; gene8822; gene8823; gene9312; gene9739; gene10277; gene10644; gene11029; gene11032; gene11408; gene11564; gene11649; gene12052; gene12359; gene12361; gene13994; gene14027; gene14117; gene15117; gene15446; gene15538; gene15716; gene15910; gene16409; gene16730; gene16961; gene17190; gene17204; gene17205; gene17230; gene17243; gene17310; gene17415; gene17736; gene17978; gene18096; gene18185; gene18338; gene18501; gene18927; gene19548; gene19750; gene19826; gene19860; gene19935; gene19976; gene20205; gene20299; gene20381; gene20416; gene20506; gene20651; gene20739; gene20891; gene20932; gene21654; gene21690; gene23885; gene23928; gene24167; gene24228; gene25640; gene25641; gene26432; gene26477; gene26542; gene26631; gene26707; gene26791; Pver_novel_model_340_5de57afd
enriched_vs_control,6.818181818,detection of stimulus,gene82; gene1184; gene1513; gene1816; gene3913; gene3915; gene5946; gene5947; gene5949; gene6341; gene7598; gene8614; gene8692; gene8693; gene8706; gene9266; gene11061; gene11090; gene11095; gene11478; gene13817; gene14599; gene14660; gene15069; gene15330; gene15334; gene16081; gene16511; gene16518; gene16810; gene16813; gene17533; gene17734; gene18253; gene20572; gene20756; gene20862; gene21266; gene21487; gene23009; gene23170; gene23173; gene24031; gene26304; Pver_novel_model_715_5de57afd
enriched_vs_control,16.66666667,negative regulation of cell division,gene9387; gene11054; gene11055; gene16605; gene24707; gene25238
enriched_vs_control,20,membrane depolarization,gene7950; gene8120; gene9017; gene12512; gene23101
enriched_vs_control,33.33333333,positive regulation of lipase activity,gene15654; gene15655; gene15656; Pver_novel_model_601_5de57afd
enriched_vs_control,50,positive regulation of respiratory burst,gene3261; gene19246
enriched_vs_control,50,positive regulation of positive chemotaxis to cAMP,gene7570; gene18536
enriched_vs_control,100,cellular sulfide ion homeostasis,gene1842; gene26406
enriched_vs_control,20,dehydroascorbic acid transport,gene2345; gene3800; gene10340; gene10341; gene10342; gene10343; gene10344; gene10345; gene22816; gene22817
enriched_vs_control,20,cellular response to cGMP,gene3649; gene4843; gene7570; gene7920; gene17430
enriched_vs_control,100,cellular response to diamide,gene16604
enriched_vs_control,50,abscisic acid transport,gene13279; gene18735
enriched_vs_control,50,regulation of Golgi inheritance,gene11619; gene15713
enriched_vs_control,100,cellular response to gonadotropin-releasing hormone,gene7570
enriched_vs_control,18.75,amyloid-beta clearance,gene1039; gene1126; gene1260; gene2542; gene7083; gene10268; gene12061; gene13135; gene14500; gene16615; gene16616; gene18519; gene19196; gene19246; gene20008; gene23885
enriched_vs_control,100,positive regulation of cell cycle phase transition,gene16604
enriched_vs_control,50,response to vanadate(3-),gene13135; gene19246
enriched_vs_control,100,protein localization to mitotic spindle pole body,gene11175
enriched_vs_control,100,positive regulation of RNA biosynthetic process,gene9524
enriched_vs_control,100,negative regulation of cellular response to transforming growth factor beta stimulus,gene3838
enriched_vs_control,33.33333333,cellular response to sodium arsenite,gene7050; gene9847; gene16604
enriched_vs_control,25,response to resveratrol,gene864; gene13135; gene16790; gene19246
enriched_vs_control,33.33333333,positive regulation of protein localization to nucleolus,gene1708; gene9524; gene14070
enriched_vs_control,20,neuron projection maintenance,gene5995; gene7987; gene13135; gene14417; gene19246
enriched_vs_control,100,response to melanocyte-stimulating hormone,gene15943
enriched_vs_control,50,negative regulation of feeding behavior,gene13135; gene19246